[
  {
    "shippingMethodId": "5171DD86-C077-0726-C448-AC14145F9026",
    "name": "Standard delivery",
    "description": null,
    "logo": null
  },
  {
    "shippingMethodId": "5171DD86-4B9C-4281-30BC-AC14145F908F",
    "name": "Express delivery",
    "description": null,
    "logo": null
  },
  {
    "shippingMethodId": "5171DD86-CCFD-ED56-DBF3-AC14145F900E",
    "name": "Customer pickup",
    "description": null,
    "logo": null
  }
]
