[
    {
        "shippingMethodId": "532BBA27-C69F-25CD-1146-AC13320B3780",
        "name": "Standard delivery",
        "description": "Descriptive text of delivery costs and conditions. Can contain HTML",
        "logo": "https://url/to/shippingmethod-logo.png"
    },
    {
        "shippingMethodId": "532BBA27-6AEE-90AE-792F-AC13320B370E",
        "name": "Express delivery",
        "description": "Descriptive text of delivery costs and conditions. Can contain HTML",
        "logo": "https://url/to/shippingmethod-logo.png"
    }
]